{
  "$schema":"https://json-schema.org/draft/2020-12/schema",
  "$id":"https://open-agent-workflow.dev/schemas/v1/profile-recipe.schema.json",
  "type":"object","additionalProperties":false,
  "required":["schema_version","recipe_version","id","display_name","required_responsibilities","nodes","incident_routes","entry","terminal_gates","stable_boundaries"],
  "properties":{"schema_version":{"const":"oaw.profile-recipe/v1"},"recipe_version":{"type":"string","pattern":"^(0|[1-9][0-9]*)\\.(0|[1-9][0-9]*)\\.(0|[1-9][0-9]*)$"},"id":{"type":"string","pattern":"^[a-z0-9][a-z0-9.-]*/[a-z0-9][a-z0-9._-]*$"},"display_name":{"type":"string","minLength":1},"required_responsibilities":{"type":"array","uniqueItems":true,"items":{"type":"string","minLength":1}},"nodes":{"type":"array","uniqueItems":true,"items":{"$ref":"#/$defs/node"}},"incident_routes":{"type":"array","uniqueItems":true,"items":{"$ref":"#/$defs/route"}},"entry":{"type":"string","minLength":1},"terminal_gates":{"type":"array","uniqueItems":true,"items":{"type":"string","minLength":1}},"stable_boundaries":{"type":"array","uniqueItems":true,"items":{"type":"string","minLength":1}}},
  "$defs":{"selector":{"type":"object","additionalProperties":false,"required":["provider_id","capability_id"],"properties":{"provider_id":{"type":"string","pattern":"^[a-z0-9][a-z0-9.-]*/[a-z0-9][a-z0-9._-]*$"},"capability_id":{"type":"string","pattern":"^[a-z0-9][a-z0-9.-]*$"}}},"transition":{"type":"object","additionalProperties":false,"required":["signal","target"],"properties":{"signal":{"enum":["succeeded","finding","remediated"]},"target":{"type":"string","minLength":1}}},"node":{"oneOf":[{"type":"object","additionalProperties":false,"required":["id","kind","responsibility","selector","transitions"],"properties":{"id":{"type":"string","pattern":"^[a-z0-9][a-z0-9.-]*$"},"kind":{"enum":["phase","incident-handler","gate"]},"responsibility":{"type":"string","minLength":1},"selector":{"$ref":"#/$defs/selector"},"optional":{"type":"boolean"},"transitions":{"type":"array","items":{"$ref":"#/$defs/transition"}}}},{"type":"object","additionalProperties":false,"required":["id","kind","responsibility","selector","phase","transitions"],"properties":{"id":{"type":"string","pattern":"^[a-z0-9][a-z0-9.-]*$"},"kind":{"const":"procedure"},"responsibility":{"type":"string","minLength":1},"selector":{"$ref":"#/$defs/selector"},"phase":{"type":"string","minLength":1},"optional":{"type":"boolean"},"transitions":{"type":"array","maxItems":0}}},{"type":"object","additionalProperties":false,"required":["id","kind","responsibility","selector","transitions"],"properties":{"id":{"type":"string","pattern":"^[a-z0-9][a-z0-9.-]*$"},"kind":{"const":"checkpoint"},"responsibility":{"type":"string"},"selector":{"$ref":"#/$defs/selector"},"optional":{"type":"boolean"},"transitions":{"type":"array","items":{"$ref":"#/$defs/transition"}}}}]},"route":{"type":"object","additionalProperties":false,"required":["incident","handler"],"properties":{"incident":{"enum":["functional-failure","build-failure","dependency-failure","type-failure","security-finding"]},"handler":{"type":"string","minLength":1}}}
}}
